{
  "$schema": "https://json-schema.org/draft-07/schema#",
  "$id": "https://acp-protocol.dev/schemas/v1/cache.schema.json",
  "title": "ACP Cache File",
  "description": "AI Context Protocol cache file format (.acp.cache.json)",
  "type": "object",
  "required": ["version", "generated_at", "project", "stats", "source_files", "files", "symbols"],
  "properties": {
    "version": {
      "type": "string",
      "description": "ACP specification version",
      "pattern": "^\\d+\\.\\d+\\.\\d+",
      "examples": ["1.0.0"]
    },
    "generated_at": {
      "type": "string",
      "format": "date-time",
      "description": "ISO 8601 timestamp when cache was generated"
    },
    "git_commit": {
      "type": ["string", "null"],
      "description": "Git commit SHA if project is in a git repository",
      "pattern": "^[a-f0-9]{40}$"
    },
    "project": {
      "type": "object",
      "description": "Project metadata",
      "required": ["name", "root"],
      "properties": {
        "name": {
          "type": "string",
          "description": "Project name"
        },
        "root": {
          "type": "string",
          "description": "Absolute path to project root"
        },
        "description": {
          "type": "string",
          "description": "Project description"
        }
      }
    },
    "stats": {
      "type": "object",
      "description": "Aggregate statistics",
      "required": ["files", "symbols", "lines"],
      "properties": {
        "files": {
          "type": "integer",
          "minimum": 0,
          "description": "Total indexed files"
        },
        "symbols": {
          "type": "integer",
          "minimum": 0,
          "description": "Total indexed symbols"
        },
        "lines": {
          "type": "integer",
          "minimum": 0,
          "description": "Total lines of code"
        }
      }
    },
    "source_files": {
      "type": "object",
      "description": "Map of relative file paths to modification times for staleness detection",
      "additionalProperties": {
        "type": "string",
        "format": "date-time",
        "description": "ISO 8601 timestamp of last modification"
      }
    },
    "files": {
      "type": "object",
      "description": "Map of relative file paths to file entries",
      "additionalProperties": {
        "$ref": "#/$defs/file_entry"
      }
    },
    "symbols": {
      "type": "object",
      "description": "Map of qualified symbol names to symbol entries",
      "additionalProperties": {
        "$ref": "#/$defs/symbol_entry"
      }
    },
    "graph": {
      "type": "object",
      "description": "Call graph relationships",
      "properties": {
        "forward": {
          "type": "object",
          "description": "Map of symbol to symbols it calls",
          "additionalProperties": {
            "type": "array",
            "items": {
              "type": "string"
            }
          }
        },
        "reverse": {
          "type": "object",
          "description": "Map of symbol to symbols that call it",
          "additionalProperties": {
            "type": "array",
            "items": {
              "type": "string"
            }
          }
        }
      }
    },
    "domains": {
      "type": "object",
      "description": "Domain index",
      "additionalProperties": {
        "$ref": "#/$defs/domain_entry"
      }
    },
    "constraints": {
      "type": "object",
      "description": "Constraint index",
      "properties": {
        "by_file": {
          "type": "object",
          "description": "Map of file path to constraints",
          "additionalProperties": {
            "$ref": "#/$defs/file_constraints"
          }
        },
        "by_lock_level": {
          "type": "object",
          "description": "Map of lock level to file paths",
          "additionalProperties": {
            "type": "array",
            "items": {
              "type": "string"
            }
          }
        }
      }
    }
  },
  "$defs": {
    "inline_annotation": {
      "type": "object",
      "description": "Inline annotation entry (RFC-001)",
      "required": ["type", "line", "directive"],
      "properties": {
        "type": {
          "type": "string",
          "enum": ["critical", "todo", "fixme", "perf", "hack"],
          "description": "Inline annotation type"
        },
        "value": {
          "type": "string",
          "description": "Annotation value (task description, issue, etc.)"
        },
        "line": {
          "type": "integer",
          "minimum": 1,
          "description": "Line number"
        },
        "directive": {
          "type": "string",
          "description": "Self-documenting directive for AI (RFC-001)"
        },
        "ticket": {
          "type": "string",
          "description": "Related issue/ticket reference"
        },
        "expires": {
          "type": "string",
          "format": "date",
          "description": "Expiration date for hacks"
        },
        "auto_generated": {
          "type": "boolean",
          "default": false,
          "description": "True if directive was auto-generated (RFC-001)"
        }
      }
    },
    "param_entry": {
      "type": "object",
      "description": "Parameter documentation entry (RFC-001)",
      "required": ["name"],
      "properties": {
        "name": {
          "type": "string",
          "description": "Parameter name"
        },
        "description": {
          "type": "string",
          "description": "Parameter description"
        },
        "directive": {
          "type": "string",
          "description": "Directive for parameter usage (RFC-001)"
        }
      }
    },
    "returns_entry": {
      "type": "object",
      "description": "Return value documentation entry (RFC-001)",
      "properties": {
        "description": {
          "type": "string",
          "description": "Return value description"
        },
        "directive": {
          "type": "string",
          "description": "Directive for handling return value (RFC-001)"
        }
      }
    },
    "throws_entry": {
      "type": "object",
      "description": "Exception documentation entry (RFC-001)",
      "required": ["exception"],
      "properties": {
        "exception": {
          "type": "string",
          "description": "Exception type"
        },
        "description": {
          "type": "string",
          "description": "When exception is thrown"
        },
        "directive": {
          "type": "string",
          "description": "How to handle the exception (RFC-001)"
        }
      }
    },
    "symbol_constraints": {
      "type": "object",
      "description": "Symbol-level constraints (RFC-001)",
      "properties": {
        "lock_level": {
          "type": "string",
          "enum": ["frozen", "restricted", "approval-required", "tests-required", "docs-required", "review-required", "normal", "experimental"],
          "description": "Lock level constraint"
        },
        "lock_reason": {
          "type": "string",
          "description": "Structured reason for lock"
        },
        "directive": {
          "type": "string",
          "description": "Self-documenting directive for AI (RFC-001)"
        },
        "auto_generated": {
          "type": "boolean",
          "default": false,
          "description": "True if directive was auto-generated (RFC-001)"
        }
      }
    },
    "file_entry": {
      "type": "object",
      "required": ["path", "lines", "language", "exports", "imports"],
      "properties": {
        "path": {
          "type": "string",
          "description": "Relative path from project root"
        },
        "module": {
          "type": ["string", "null"],
          "description": "Human-readable module name (from @acp:module)"
        },
        "summary": {
          "type": ["string", "null"],
          "description": "Brief file description (from @acp:summary)"
        },
        "purpose": {
          "type": ["string", "null"],
          "description": "File purpose from @acp:purpose (RFC-001)"
        },
        "owner": {
          "type": ["string", "null"],
          "description": "Team ownership from @acp:owner (RFC-001)"
        },
        "inline": {
          "type": "array",
          "items": {
            "$ref": "#/$defs/inline_annotation"
          },
          "default": [],
          "description": "Inline annotations (RFC-001)"
        },
        "lines": {
          "type": "integer",
          "minimum": 0,
          "description": "Line count"
        },
        "language": {
          "type": "string",
          "description": "Programming language identifier",
          "enum": ["typescript", "javascript", "python", "rust", "go", "java", "c-sharp", "cpp", "c", "ruby", "php", "swift", "kotlin"]
        },
        "domains": {
          "type": "array",
          "items": {
            "type": "string"
          },
          "default": [],
          "description": "Domain classifications (from @acp:domain)"
        },
        "layer": {
          "type": ["string", "null"],
          "description": "Architectural layer (from @acp:layer)"
        },
        "stability": {
          "type": ["string", "null"],
          "enum": [null, "stable", "experimental", "deprecated"],
          "description": "Stability level"
        },
        "exports": {
          "type": "array",
          "items": {
            "type": "string"
          },
          "default": [],
          "description": "Exported symbols (qualified names)"
        },
        "imports": {
          "type": "array",
          "items": {
            "type": "string"
          },
          "default": [],
          "description": "Imported modules"
        },
        "ai_hints": {
          "type": "array",
          "items": {
            "type": "string"
          },
          "default": [],
          "description": "AI behavioral hints (e.g., 'ai-careful', 'ai-readonly')"
        },
        "git": {
          "$ref": "#/$defs/git_file_info",
          "description": "Git metadata for the file"
        }
      }
    },
    "symbol_entry": {
      "type": "object",
      "required": ["name", "qualified_name", "type", "file", "lines", "exported"],
      "properties": {
        "name": {
          "type": "string",
          "description": "Simple symbol name"
        },
        "qualified_name": {
          "type": "string",
          "description": "Format: file_path:class.symbol"
        },
        "type": {
          "type": "string",
          "enum": ["function", "method", "class", "interface", "type", "enum", "struct", "trait", "const"],
          "description": "Symbol type"
        },
        "file": {
          "type": "string",
          "description": "Containing file path"
        },
        "lines": {
          "type": "array",
          "items": {
            "type": "integer"
          },
          "minItems": 2,
          "maxItems": 2,
          "description": "[start_line, end_line]"
        },
        "signature": {
          "type": ["string", "null"],
          "description": "Function signature if applicable"
        },
        "summary": {
          "type": ["string", "null"],
          "description": "Brief description (from @acp:summary)"
        },
        "purpose": {
          "type": ["string", "null"],
          "description": "Symbol purpose from @acp:fn/@acp:class/etc (RFC-001)"
        },
        "params": {
          "type": "array",
          "items": {
            "$ref": "#/$defs/param_entry"
          },
          "default": [],
          "description": "Parameter descriptions (RFC-001)"
        },
        "returns": {
          "$ref": "#/$defs/returns_entry",
          "description": "Return value description (RFC-001)"
        },
        "throws": {
          "type": "array",
          "items": {
            "$ref": "#/$defs/throws_entry"
          },
          "default": [],
          "description": "Exception descriptions (RFC-001)"
        },
        "constraints": {
          "$ref": "#/$defs/symbol_constraints",
          "description": "Symbol-level constraints (RFC-001)"
        },
        "async": {
          "type": "boolean",
          "default": false,
          "description": "Whether async"
        },
        "exported": {
          "type": "boolean",
          "description": "Whether exported"
        },
        "visibility": {
          "type": "string",
          "enum": ["public", "private", "protected"],
          "default": "public",
          "description": "Symbol visibility"
        },
        "calls": {
          "type": "array",
          "items": {
            "type": "string"
          },
          "default": [],
          "description": "Symbols this calls (qualified names)"
        },
        "called_by": {
          "type": "array",
          "items": {
            "type": "string"
          },
          "default": [],
          "description": "Symbols calling this (qualified names)"
        },
        "git": {
          "$ref": "#/$defs/git_symbol_info",
          "description": "Git metadata for the symbol"
        }
      }
    },
    "domain_entry": {
      "type": "object",
      "required": ["name", "files", "symbols"],
      "properties": {
        "name": {
          "type": "string",
          "description": "Domain identifier"
        },
        "description": {
          "type": "string",
          "description": "Human description"
        },
        "files": {
          "type": "array",
          "items": {
            "type": "string"
          },
          "description": "Files in this domain"
        },
        "symbols": {
          "type": "array",
          "items": {
            "type": "string"
          },
          "description": "Symbols in this domain (qualified names)"
        }
      }
    },
    "file_constraints": {
      "type": "object",
      "properties": {
        "lock_level": {
          "type": "string",
          "enum": ["frozen", "restricted", "approval-required", "tests-required", "docs-required", "review-required", "normal", "experimental"],
          "description": "Lock level constraint"
        },
        "lock_reason": {
          "type": "string",
          "description": "Reason for lock level"
        },
        "directive": {
          "type": "string",
          "description": "Self-documenting directive for AI (RFC-001)"
        },
        "auto_generated": {
          "type": "boolean",
          "default": false,
          "description": "True if directive was auto-generated from defaults (RFC-001)"
        },
        "style": {
          "type": "string",
          "description": "Style guide constraint"
        },
        "behavior": {
          "type": "string",
          "enum": ["conservative", "balanced", "aggressive"],
          "description": "AI behavior constraint (matches config.schema.json)"
        },
        "quality": {
          "type": "array",
          "items": {
            "type": "string"
          },
          "description": "Quality constraints"
        }
      }
    },
    "git_file_info": {
      "type": "object",
      "description": "Git metadata for a file",
      "required": ["last_commit", "last_author", "last_modified", "commit_count", "contributors"],
      "properties": {
        "last_commit": {
          "type": "string",
          "description": "SHA of the last commit that modified this file",
          "pattern": "^[a-f0-9]{40}$"
        },
        "last_author": {
          "type": "string",
          "description": "Author of the last commit"
        },
        "last_modified": {
          "type": "string",
          "format": "date-time",
          "description": "ISO 8601 timestamp of the last modification"
        },
        "commit_count": {
          "type": "integer",
          "minimum": 0,
          "description": "Number of commits that have modified this file"
        },
        "contributors": {
          "type": "array",
          "items": {
            "type": "string"
          },
          "description": "List of unique contributors to this file"
        }
      }
    },
    "git_symbol_info": {
      "type": "object",
      "description": "Git metadata for a symbol",
      "required": ["last_commit", "last_author", "code_age_days"],
      "properties": {
        "last_commit": {
          "type": "string",
          "description": "SHA of the last commit that modified this symbol",
          "pattern": "^[a-f0-9]{40}$"
        },
        "last_author": {
          "type": "string",
          "description": "Author of the last commit that modified this symbol"
        },
        "code_age_days": {
          "type": "integer",
          "minimum": 0,
          "description": "Number of days since this code was last modified"
        }
      }
    }
  }
}
